{
    "name": "Bucket_for_tabe_98221ced868f015585263b17254c014d0564",
    "targetDataset": {
        "id": "98221ced868f015585263b1721014d09"
    },
    "operation": {
        "id": "Operation_Type=Replace"
    },
    "schema": {
        "parseOptions": {
            "fieldsDelimitedBy": ",",
            "fieldsEnclosedBy": "\"",
            "headerLinesToIgnore": 1,
            "charset": {
                "id": "Encoding=UTF-8"
            },
            "type": {
                "id": "Schema_File_Type=Delimited"
            }
        },
        "fields": [
            {
                "ordinal": 1,
                "name": "Employee",
                "description": "Employee",
                "precision": 255,
                "scale": 0,
                "type": {
                    "id": "fdd7dd26156610006a12d4fd1ea300ce",
                    "descriptor": "Text"
                }
            },
            {
                "ordinal": 2,
                "name": "Employee_ID",
                "description": "Employee ID",
                "precision": 255,
                "scale": 0,
                "type": {
                    "id": "fdd7dd26156610006a12d4fd1ea300ce",
                    "descriptor": "Text"
                }
            },
            {
                "ordinal": 3,
                "name": "Job_Title",
                "description": "Job Title",
                "precision": 255,
                "scale": 0,
                "type": {
                    "id": "fdd7dd26156610006a12d4fd1ea300ce",
                    "descriptor": "Text"
                }
            },
            {
                "ordinal": 4,
                "name": "Supervisory_Organization",
                "description": "Supervisory Organization",
                "precision": 255,
                "scale": 0,
                "type": {
                    "id": "fdd7dd26156610006a12d4fd1ea300ce",
                    "descriptor": "Text"
                }
            },
            {
                "ordinal": 5,
                "name": "Supervisory_Organization_ID",
                "description": "Supervisory Organization - ID",
                "precision": 255,
                "scale": 0,
                "type": {
                    "id": "fdd7dd26156610006a12d4fd1ea300ce",
                    "descriptor": "Text"
                }
            },
            {
                "ordinal": 6,
                "name": "Manager",
                "description": "Manager",
                "precision": 255,
                "scale": 0,
                "type": {
                    "id": "fdd7dd26156610006a12d4fd1ea300ce",
                    "descriptor": "Text"
                }
            },
            {
                "ordinal": 7,
                "name": "Business_Site",
                "description": "Business Site",
                "precision": 255,
                "scale": 0,
                "type": {
                    "id": "fdd7dd26156610006a12d4fd1ea300ce",
                    "descriptor": "Text"
                }
            },
            {
                "ordinal": 8,
                "name": "Annual_Salary",
                "description": "Annual Salary",
                "precision": 18,
                "scale": 2,
                "type": {
                    "id": "32e3fa0dd9ea1000072bac410415127a",
                    "descriptor": "Numeric"
                }
            },
            {
                "ordinal": 9,
                "name": "Salary_Currency",
                "description": "Salary Currency",
                "precision": 255,
                "scale": 0,
                "type": {
                    "id": "fdd7dd26156610006a12d4fd1ea300ce",
                    "descriptor": "Text"
                }
            },
            {
                "ordinal": 10,
                "name": "Last_Performance_Rating",
                "description": "Last Performance Rating",
                "precision": 255,
                "scale": 0,
                "type": {
                    "id": "fdd7dd26156610006a12d4fd1ea300ce",
                    "descriptor": "Text"
                }
            }
        ],
        "schemaVersion": {
            "id": "Schema_Version=1.0"
        }
    }
}